[{"job_id":"88f12179777fa977c5d3b5497511b476398f00f1ea2ef21c0bbd256b209160a6","source_job_id":"7544547","requisition_id":"See Opening ID","company_id":"9bbd2155e18e4f72","company_name":"Stripe","title":"Operations Associate, New Grad (Mexico)","job_url":"https://stripe.com/jobs/search?gh_jid=7544547","apply_url":"https://stripe.com/jobs/search?gh_jid=7544547","careers_url":null,"source_url":null,"summary":"Who we are\n>\nAbout Stripe\n>\nStripe is a financial infrastructure platform for businesses. Millions of companies-from the world's largest enterprises to the most ambitious startups-use Stripe to accept payments, grow their revenue, and accelerate new business opportunities. Our mission is to increase the GDP of the internet, and we have a staggering amount of work ahead. That means you have an unprecedented opportunity to put the global economy within everyone's reach while doing the most important work of your career.\n>\nStripe was built with simplicity in mind. We strive to deliver frictionless experiences for all of our users, whether they are an Independent Business, Startup, SMB, or Enterprise, and our mission is to provide all Stripe Users with the best support experience possible. Today, Stripe handles over a million support cases per year and processes millions of internal transactions. We're going to achieve excellence by thinking of support in a novel, solution-oriented way, and viewing operations as an integral enabler of all of Stripe's growth.\n>\nAbout the team\n>\nAt Stripe, our Mexico City office is a vibrant hub at the forefront of our mission to reshape the financial landscape for businesses worldwide. Our team prioritizes collaboration, innovation, and excellence. As a member of the Mexico City team, you'll be part of a mission-driven community dedicated to enhancing the global economy and increasing the GDP of the internet. We strive for excellence by creating with craft and beauty, while having fun and celebrating our successes together.\n>\nWe cultivate a culture of collaboration, inclusivity, and support where every team member's voice matters. Our commitment shines through as we handle over a million support cases each year, empowering our users not just to solve problems but to achieve their goals.\n>\nWhat you'll do\n>\nResponsibilities\n>\nHave the opportunity to join an operations team across Risk, Product Support, and Financial...","career_level":"new_grad","career_level_confidence":0.82,"employment_type":"unknown","disciplines":{"primary":"infrastructure","secondary":["product"],"confidence":0.5},"skills":[],"locations":[{"raw":"Mexico City, Mexico","city":"Mexico City","region":"Mexico","country":"Mexico","country_code":"MX","continent":"North America"}],"workplace_type":"onsite","remote_scope":"unknown","remote_allowed_countries":[],"remote_allowed_regions":[],"source_posted_at":"2026-01-28T19:00:36Z","first_seen_at":"2026-09-08T22:23:17.308421Z","last_seen_at":"2026-09-15T18:34:18.201867Z","last_changed_at":"2026-09-09T05:11:26.695724Z","closed_at":null,"reopened_at":null,"application_deadline":null,"expected_start_date":null,"expected_end_date":null,"duration_months":null,"academic_term":"unknown","compensation":null,"education":{"student_required":null,"return_to_school_required":null,"degree_levels":[],"graduation_years":[],"majors":[],"academic_years":[]},"eligibility":{"work_authorization":null,"explicit_allowed_countries":[],"explicit_excluded_countries":[],"citizenship_requirements":[],"residency_requirements":[],"security_clearance":null,"export_control_restrictions":false,"language_requirements":[],"origin_match":"unknown"},"mobility":{"visa_sponsorship":{"status":"unknown","confidence":0.0,"extraction_rule":null,"evidence_excerpt":null},"immigration_assistance":{"status":"unknown","confidence":0.0,"extraction_rule":null,"evidence_excerpt":null},"international_candidates":{"status":"unknown","confidence":0.0,"extraction_rule":null,"evidence_excerpt":null},"relocation_assistance":{"status":"unknown","confidence":0.0,"extraction_rule":null,"evidence_excerpt":null},"relocation_stipend":{"status":"unknown","confidence":0.0,"extraction_rule":null,"evidence_excerpt":null},"moving_expenses":{"status":"unknown","confidence":0.0,"extraction_rule":null,"evidence_excerpt":null},"airfare":{"status":"unknown","confidence":0.0,"extraction_rule":null,"evidence_excerpt":null},"travel_reimbursement":{"status":"unknown","confidence":0.0,"extraction_rule":null,"evidence_excerpt":null},"housing_provided":{"status":"unknown","confidence":0.0,"extraction_rule":null,"evidence_excerpt":null},"housing_stipend":{"status":"unknown","confidence":0.0,"extraction_rule":null,"evidence_excerpt":null},"temporary_housing":{"status":"unknown","confidence":0.0,"extraction_rule":null,"evidence_excerpt":null},"fully_funded_relocation":{"status":"unknown","confidence":0.0,"extraction_rule":null,"evidence_excerpt":null}},"provenance":{"adapter":"greenhouse","source_id":"aad0894ded52f16c","source_job_id":"7544547","fetched_at":"2026-09-15T18:34:18.201867Z","source_posted_at":"2026-01-28T19:00:36Z","first_seen_at":"2026-09-08T22:23:17.308421Z","parser_version":"1.0.0","classification_version":"1.0.0","content_hash":"94133247b24f09e735e5cbf401ad03442e2b841694e3db92d05325192ba2914c","source_health_at_fetch":"healthy","first_party_verified":false},"lifecycle":"open","extra":{"internal_job_id":3339781,"company_name":"Stripe"}},{"job_id":"3506db3af2111b7f617f0010d7f43c81b3e6e39ccddcd59792d62df9acdc7b99","source_job_id":"8031833","requisition_id":"See Opening ID","company_id":"9bbd2155e18e4f72","company_name":"Stripe","title":"Software Engineer, Intern","job_url":"https://stripe.com/jobs/search?gh_jid=8031833","apply_url":"https://stripe.com/jobs/search?gh_jid=8031833","careers_url":null,"source_url":null,"summary":"Who we are\n>\nAbout Stripe\n>\nStripe is a technology company focused on improving the conditions for economic growth and prosperity. We build programmable financial infrastructure, rethinking from first principles how financial services should work, to make it easier and cheaper for any business to start and scale. More than 10 million businesses build on Stripe, spanning the economic frontier-from solo founders to established enterprises-united by a practical focus on growth. The most ambitious companies in the world use Stripe as core infrastructure to grow faster. They process trillions of dollars a year on Stripe, equivalent to around 1.6% of global GDP. While economic growth makes everyone better off, open markets also enable greater variety. When any business can easily serve a global customer base, the quality and diversity of products in the world increase, and craft and creativity are unleashed into the smallest niches. Our own growth is wholly contingent on the success of the businesses building on Stripe. We therefore invest back into our technology at an unusual rate. We make upgrades to our products every single day to deliver compounding gains to our customers. We maintain some of the most reliable APIs on the internet. We build entirely new pieces of financial infrastructure to enable new ideas. And our significant advances in risk and fraud infrastructure over many years are making the internet economy safer and more accessible.\n>\nThough people at Stripe don't tend to take themselves seriously, Stripe is a fairly serious place: our customers are depending on us for their livelihoods. We admire ambition, intensity, curiosity, humility, and rigor. The most effective people become knowledgeable about many domains besides their own. Any company is an applied exercise in understanding some aspect of society or the market. In working with so many (especially the new and innovative ones), we think that Stripe is one of the very best places to learn about...","career_level":"internship","career_level_confidence":0.82,"employment_type":"unknown","disciplines":{"primary":"infrastructure","secondary":["it"],"confidence":0.5},"skills":["Go","Java","JavaScript"],"locations":[{"raw":"Bengaluru","city":"Bengaluru","region":null,"country":null,"country_code":null,"continent":null}],"workplace_type":"onsite","remote_scope":"unknown","remote_allowed_countries":[],"remote_allowed_regions":[],"source_posted_at":"2026-07-10T05:33:52Z","first_seen_at":"2026-09-08T22:23:17.308421Z","last_seen_at":"2026-09-15T18:34:18.201867Z","last_changed_at":"2026-09-09T05:11:26.695724Z","closed_at":null,"reopened_at":null,"application_deadline":null,"expected_start_date":null,"expected_end_date":null,"duration_months":null,"academic_term":"unknown","compensation":null,"education":{"student_required":null,"return_to_school_required":null,"degree_levels":[],"graduation_years":[],"majors":[],"academic_years":[]},"eligibility":{"work_authorization":null,"explicit_allowed_countries":[],"explicit_excluded_countries":[],"citizenship_requirements":[],"residency_requirements":[],"security_clearance":null,"export_control_restrictions":false,"language_requirements":[],"origin_match":"unknown"},"mobility":{"visa_sponsorship":{"status":"unknown","confidence":0.0,"extraction_rule":null,"evidence_excerpt":null},"immigration_assistance":{"status":"unknown","confidence":0.0,"extraction_rule":null,"evidence_excerpt":null},"international_candidates":{"status":"unknown","confidence":0.0,"extraction_rule":null,"evidence_excerpt":null},"relocation_assistance":{"status":"unknown","confidence":0.0,"extraction_rule":null,"evidence_excerpt":null},"relocation_stipend":{"status":"unknown","confidence":0.0,"extraction_rule":null,"evidence_excerpt":null},"moving_expenses":{"status":"unknown","confidence":0.0,"extraction_rule":null,"evidence_excerpt":null},"airfare":{"status":"unknown","confidence":0.0,"extraction_rule":null,"evidence_excerpt":null},"travel_reimbursement":{"status":"unknown","confidence":0.0,"extraction_rule":null,"evidence_excerpt":null},"housing_provided":{"status":"unknown","confidence":0.0,"extraction_rule":null,"evidence_e